Title,CreationDate
"How to handle a skewed response in H2O algorithms","2018-01-18 20:47:21"
"Python cannot find package h2o in anaconda","2017-06-15 22:20:52"
"Fastest way to read in 100,000 .dat.gz files","2016-03-03 05:00:39"
"How to get sparse matrices into H2O?","2015-09-29 11:51:22"
"GBM Model in h2o is producing different Variable Importance than with R?","2017-03-16 18:44:51"
"Transforming h2o model into non-h2o one","2016-08-29 21:07:51"
"Securing a nodejs / sailsjs API with OAuth2","2014-04-11 07:00:06"
"How to get data into h2o fast","2018-04-03 16:06:07"
"Start multiple h2o cluster from within R","2016-07-18 15:59:14"
"R H2O with 32-bit java","2016-04-11 11:28:21"
"How to convert r data frame to h2o object","2014-12-18 18:32:49"
"Error with H2O in R - can't connect to local host","2017-09-24 16:40:59"
"How to cast data from long to wide format in H2O?","2016-12-27 06:26:32"
"Why connection is terminating","2015-06-17 05:03:54"
"Calculating MAPE in H2o: Error: Provided column type POSIXct is unknown","2018-08-21 06:36:36"
"H2O R api: retrieving optimal model from grid search","2016-02-26 17:24:57"
"What's the difference between passport and oauth?","2016-04-08 03:16:48"
"R: Plot trees from h2o.randomForest() and h2o.gbm()","2016-05-04 00:25:33"
"How to get different Variable Importance for each class in a binary h2o GBM in R?","2017-12-02 15:00:17"
"Unable to convert data frame to h2o object","2015-07-15 23:14:27"
"Loading data bigger than the memory size in h2o","2015-12-04 07:10:29"
"Subsetting in H2O R","2014-11-28 03:49:37"
"What are the constraints of FUN in H2O's apply function?","2017-06-03 01:09:23"
"implementing own oauth2 server and api server","2016-01-12 10:25:33"
"How to understand the metrics of H2OModelMetrics Object through h2o.performance","2017-04-29 19:03:08"
"What is the measure used for ""importance"" in the h2o random Forest","2016-03-15 20:09:07"
"Print ""pretty"" tables for h2o models in R","2016-08-11 10:39:31"
"Predict classes or class probabilities?","2018-07-16 18:06:30"
"How to drop rows in an H2OFrame?","2016-07-12 17:05:08"
"how to save/load a trained model in H2o?","2015-07-20 17:10:10"
"h2o implementation in R","2016-08-22 05:24:12"
"Difference between spark with h2o and sparkling water","2017-04-05 16:08:14"
"How do I write h2o webserver mruby handlers for WordPress multisite?","2016-09-01 13:42:14"
"Can I use autoencoder for clustering?","2016-11-24 06:20:40"
"Implementation of LIME on h2o modelling in R","2017-07-12 13:56:50"